{
  "schema_version": "1",
  "stem": "<STEM>",
  "item_key": "<ITEM_KEY>",
  "path": "<PATH>",
  "type": "<TYPE>",
  "type_confidence": 0.0,
  "actions": [
    {
      "kind": "create_atomic_note",
      "source_stem": "<SOURCE_STEM>",
      "suggested_title": "<SUGGESTED_TITLE>",
      "template": "<TEMPLATE>",
      "location": "<LOCATION>",
      "candidate_mocs": [
        {
          "path": "<PATH>",
          "score": 0.0,
          "pre_check": false
        }
      ],
      "tags_to_add": [],
      "classification": {
        "category": "<CATEGORY>",
        "confidence": 0.0
      },
      "needs_new_moc": false,
      "proposed_moc_topic": "<PROPOSED_MOC_TOPIC>",
      "atomic_note_worthiness": 0.0,
      "alternatives": [
        {
          "kind": "<KIND>",
          "reason": "<REASON>"
        }
      ]
    },
    {
      "kind": "update_daily",
      "date": "<DATE>",
      "daily_note_path": "<DAILY_NOTE_PATH>",
      "updates": [
        {
          "kind": "tracker",
          "field": "<FIELD>",
          "value": "<VALUE>",
          "syntax": "inline_field",
          "confidence": 0.0,
          "reason": "<REASON>",
          "section": "<SECTION>"
        },
        {
          "kind": "log_entry",
          "content": "<CONTENT>",
          "reason": "<REASON>",
          "confidence": 0.0,
          "position": "after_last_line",
          "time": "<TIME>",
          "time_source": "<TIME_SOURCE>"
        },
        {
          "kind": "log_link",
          "target_stem": "<TARGET_STEM>",
          "reason": "<REASON>",
          "confidence": 0.0,
          "position": "after_last_line",
          "time": "<TIME>",
          "time_source": "<TIME_SOURCE>"
        }
      ],
      "daily_note_stem": "<DAILY_NOTE_STEM>"
    },
    {
      "kind": "create_moc",
      "moc_title": "<MOC_TITLE>",
      "parent_moc": "<PARENT_MOC>"
    },
    {
      "kind": "modify_note",
      "target_path": "<TARGET_PATH>",
      "diff_description": "<DIFF_DESCRIPTION>"
    }
  ],
  "date_relevance": {
    "date": "<DATE>",
    "source": "filename"
  },
  "issues": [],
  "duration_ms": 0,
  "force_atomic": false
}
